{
	"id": "ebsi",
	"name": {
		"de": "European Blockchain Services Infrastructure (EBSI)",
		"en": "European Blockchain Services Infrastructure (EBSI)"
	},
	"description": {
		"de": "Europäische, permissioned Blockchain-Infrastruktur mit APIs, Vertrauensdiensten und Governance für öffentliche Anwendungsfälle.",
		"en": "European permissioned blockchain infrastructure with APIs, trust services and governance for public-sector use cases."
	},
	"issuer": "Europeum-EDIC",
	"version": "0.1.1",
	"publishedAt": "2026-09-13",
	"items": [
		{
			"itemId": "openapi",
			"status": "recommended",
			"role": "consumer",
			"rationale": {
				"de": "Öffentliche API-Schnittstellen werden dokumentiert und versioniert bereitgestellt.",
				"en": "Public API interfaces are documented and published in versioned form."
			}
		},
		{
			"itemId": "openid",
			"status": "approved",
			"role": "consumer",
			"rationale": {
				"de": "OIDC-Muster werden für Identitäts- und Zugriffsflüsse genutzt.",
				"en": "OIDC patterns are used for identity and access flows."
			}
		},
		{
			"itemId": "transport-layer-security-tls",
			"status": "recommended",
			"role": "consumer",
			"rationale": {
				"de": "TLS ist Grundvoraussetzung für abgesicherte Knoten- und API-Kommunikation.",
				"en": "TLS is a baseline requirement for secure node and API communication."
			}
		}
	],
	"sources": [
		{
			"label": {
				"de": "European Blockchain Services Infrastructure",
				"en": "European Blockchain Services Infrastructure",
				"fr": "European Blockchain Services Infrastructure"
			},
			"url": "https://ebsi.eu",
			"type": "url"
		},
		{
			"type": "url",
			"label": {
				"de": "EBSI – Über uns (Governance durch Europeum-EDIC)",
				"en": "EBSI – About us (governance by Europeum-EDIC)"
			},
			"url": "https://ebsi.eu/about-us"
		},
		{
			"type": "url",
			"label": {
				"de": "EU Digital Building Blocks",
				"en": "EU Digital Building Blocks"
			},
			"url": "https://ec.europa.eu/digital-building-blocks/"
		}
	]
}
