{
	"id": "france",
	"name": {
		"de": "Frankreich Stack (DINUM/LaSuite)",
		"en": "France Stack (DINUM/LaSuite)"
	},
	"description": {
		"de": "Souveräner Kollaborations-Stack von DINUM mit ProConnect-SSO und modularen Open-Source-Diensten.",
		"en": "Sovereign collaboration stack by DINUM with ProConnect SSO and modular open-source services."
	},
	"country": "FR",
	"issuer": "DINUM / beta.gouv.fr",
	"version": "0.1.0",
	"publishedAt": "2026-04-16",
	"items": [
		{
			"itemId": "docker-swarm",
			"status": "approved",
			"role": "consumer",
			"rationale": {
				"de": "Containerisierte Auslieferung für modulare Dienste der Suite Numérique.",
				"en": "Containerized delivery for modular services in Suite Numérique."
			}
		},
		{
			"itemId": "gitlab",
			"status": "recommended",
			"role": "consumer",
			"rationale": {
				"de": "Open-Source-Entwicklung folgt einem GitLab-basierten kollaborativen Workflow.",
				"en": "Open-source development follows a GitLab-based collaborative workflow."
			}
		},
		{
			"itemId": "keycloak",
			"status": "recommended",
			"role": "consumer",
			"rationale": {
				"de": "IAM- und SSO-Muster mit OpenID Connect sind zentral für LaSuite.",
				"en": "IAM and OpenID Connect SSO patterns are central to LaSuite."
			}
		},
		{
			"itemId": "kubernetes",
			"status": "approved",
			"role": "consumer",
			"rationale": {
				"de": "Kubernetes unterstützt den Betrieb verteilter Kollaborationsdienste.",
				"en": "Kubernetes supports operation of distributed collaboration services."
			}
		},
		{
			"itemId": "openid",
			"status": "recommended",
			"role": "consumer",
			"rationale": {
				"de": "OIDC ermöglicht föderierte Anmeldung über ProConnect-ähnliche IdP-Muster.",
				"en": "OIDC enables federated sign-in through ProConnect-like IdP patterns."
			}
		},
		{
			"itemId": "postgresql",
			"status": "approved",
			"role": "consumer",
			"rationale": {
				"de": "PostgreSQL ist ein verbreiteter Datenspeicher in Verwaltungsdiensten.",
				"en": "PostgreSQL is a common data store in public services."
			}
		},
		{
			"itemId": "react",
			"status": "approved",
			"role": "consumer",
			"rationale": {
				"de": "React wird für modulare Frontends in staatlichen Portalen genutzt.",
				"en": "React is used for modular frontends in government portals."
			}
		}
	],
	"sources": [
		{
			"label": {
				"de": "La Suite Numérique",
				"en": "La Suite Numérique",
				"fr": "La Suite Numérique"
			},
			"url": "https://lasuite.numerique.gouv.fr/",
			"type": "url"
		},
		{
			"type": "url",
			"label": {
				"de": "DINUM Website",
				"en": "DINUM Website"
			},
			"url": "https://www.numerique.gouv.fr/"
		},
		{
			"type": "url",
			"label": {
				"de": "beta.gouv.fr GitHub",
				"en": "beta.gouv.fr GitHub"
			},
			"url": "https://github.com/betagouv"
		}
	]
}
