{
	"id": "opendesk",
	"name": {
		"de": "openDesk Stack",
		"en": "openDesk Stack"
	},
	"description": {
		"de": "Souveräne Workplace-Suite für die deutsche Verwaltung mit Kubernetes-Betrieb, IAM-Föderation und modularen OSS-Diensten.",
		"en": "Sovereign workplace suite for German public administration with Kubernetes operations, IAM federation and modular OSS services."
	},
	"country": "DE",
	"issuer": "ZenDiS",
	"version": "0.1.1",
	"publishedAt": "2026-06-14",
	"items": [
		{
			"itemId": "gitlab",
			"status": "recommended",
			"role": "consumer",
			"rationale": {
				"de": "openDesk wird offen über GitLab-Repositories auf openCode entwickelt und veröffentlicht.",
				"en": "openDesk is openly developed and released through GitLab repositories on openCode."
			}
		},
		{
			"itemId": "helm",
			"status": "recommended",
			"role": "consumer",
			"rationale": {
				"de": "Helm ist zentral für die paketierte Bereitstellung der Service-Landschaft.",
				"en": "Helm is central for packaged deployment of the service landscape."
			}
		},
		{
			"itemId": "keycloak",
			"status": "recommended",
			"role": "consumer",
			"rationale": {
				"de": "Keycloak bildet die IAM- und SSO-Schicht für Föderation und Rollenmodelle.",
				"en": "Keycloak forms the IAM and SSO layer for federation and role models."
			}
		},
		{
			"itemId": "kubernetes",
			"status": "recommended",
			"role": "consumer",
			"rationale": {
				"de": "Kubernetes ist die empfohlene Laufzeit für den produktiven Betrieb.",
				"en": "Kubernetes is the recommended runtime for production operations."
			}
		},
		{
			"itemId": "matrix",
			"status": "recommended",
			"role": "consumer",
			"rationale": {
				"de": "openDesk nutzt Element und den Matrix-Standard als Echtzeit-Kommunikationsschicht für Chat sowie Audio- und Videoanrufe.",
				"en": "openDesk uses Element and the Matrix standard as the real-time communication layer for chat and audio/video calls."
			}
		},
		{
			"itemId": "openid",
			"status": "approved",
			"role": "consumer",
			"rationale": {
				"de": "OIDC unterstützt standardisierte Login- und Föderationsflüsse.",
				"en": "OIDC supports standardized login and federation flows."
			}
		},
		{
			"itemId": "postgresql",
			"status": "approved",
			"role": "consumer",
			"rationale": {
				"de": "PostgreSQL ist ein typischer Datenspeicher in den angebundenen Diensten.",
				"en": "PostgreSQL is a common datastore among integrated services."
			}
		}
	],
	"sources": [
		{
			"label": {
				"de": "openDesk",
				"en": "openDesk",
				"fr": "openDesk"
			},
			"url": "https://opendesk.eu/",
			"type": "url"
		},
		{
			"type": "url",
			"label": {
				"de": "openDesk Quellcode (openCode)",
				"en": "openDesk Source (openCode)"
			},
			"url": "https://gitlab.opencode.de/bmi/opendesk"
		},
		{
			"type": "url",
			"label": {
				"de": "openDesk Docs",
				"en": "openDesk Documentation"
			},
			"url": "https://docs.opendesk.eu/"
		}
	]
}
